template_num,template_name,category,body_a,body_b_or_sign,house_or_aspect,placement_id,focus_theme,traditional_meaning_ar,evolutionary_meaning_ar,developmental_task_ar,key_references,status,content_file
14,T-Square,Aspect Templates,,,,T14_TSquare_Cardinal,Cardinal T-Square — initiating tension,المربع التائي المتشكل من ثلاثة كواكب في الأبراج الأساسية، الحمل والسرطان والميزان والجدي، يصف توتراً ديناميكياً يضغط على نقطة واحدة هي القمة. الكوكبان المتقابلان يفتحان محوراً، والكوكب الثالث يربض في الزاوية ويتلقى تربيعاً مزدوجاً من الطرفين. القراءة التقليدية ترى في هذا الشكل محركاً للفعل لا يهدأ، إذ تطلب الأبراج الأساسية البدء والمبادرة في كل لحظة. الكوكب القمة يكون مسرحاً لانفجار الطاقة الناتج عن المحور المقابل، ويتحوّل إلى نقطة الانطلاق التي يبني الإنسان حياته العملية حولها. هذا الشكل يُنتج سيرة من المشاريع المتعاقبة، ومن الأزمات التي تُحلّ بإطلاق مبادرة جديدة لا بالتأمل في القائم.,على المستوى الأعمق، يحمل هذا التكوين مهمة نفس اختارت أن تتعلم الفعل الواعي بدل ردة الفعل التلقائية. القمة في برج أساسي تشير إلى عتبة بيوغرافية يقف عندها الإنسان مراراً، يُدفَع إلى الأمام بقوة المحور المقابل ولا يجد خياراً سوى أن يطلق طاقته في العالم. النفس هنا تختار السيرة المليئة بنقاط البداية، حيث كل أزمة تفتح باباً جديداً وكل إنجاز يستدعي مشروعاً تالياً. الكرما المحمولة هي كرما القائد الذي تردّد في حياة سابقة عن أخذ زمام المبادرة فعاد ليتعلمها بقسوة الحاجة. الموهبة التي تنضج هي القدرة على إطلاق الفعل من الفراغ، على التحرك حين يقف الآخرون، على تحويل التوتر الداخلي إلى مشروع خارجي يخدم محيطاً أوسع.,المهمة الأخلاقية هي تعلّم الفعل الذي ينبع من الأنا الحرة لا من اندفاع الأبراج الأساسية وحدها. الخطر المتصلب يظهر حين يتحول الإنسان إلى آلة إنتاج للمبادرات، يطلق مشروعاً تلو الآخر بلا توقف حتى يفقد أي قدرة على التأمل، فيصبح فعله ميكانيكياً ومنفصلاً عن معناه. الخطر الوهمي يظهر حين يتضخم الإحساس بالقيادة فيتوهم صاحبه أنه مركز العالم وأن كل مبادرة منه ضرورة كونية، فيستهلك من حوله ويستهلك نفسه في وهم البطولة. التوازن الحي هو فعل القمة بوعي، استقبال الضغط من المحور المقابل دون تحوله إلى رد فعل، وإطلاق المبادرة حين يكون لها معنى حقيقي لا لمجرد تفريغ التوتر.,"Tierney, Dynamics of Aspect Analysis; Tompkins, Aspects in Astrology; Hand, Horoscope Symbols",filled,
14,T-Square,Aspect Templates,,,,T14_TSquare_Fixed,Fixed T-Square — entrenched tension,المربع التائي في الأبراج الثابتة، الثور والأسد والعقرب والدلو، يصف توتراً متجذراً يقاوم الحلّ. ثلاثة كواكب تتشابك في زوايا قائمة، اثنان في تقابل عنيد وثالث يحمل الضغط في القمة، ولكلٍ منها رغبة في البقاء حيث هو. هذا الشكل يصنع شخصيات ذات إرادة فولاذية، تحفر مجراها في الحياة بصبر يكاد لا يُصدّق، وتتمسك بمواقفها حتى حين تكون مكلفة. القراءة التقليدية تربط هذا التكوين بمسائل القيمة والسلطة والرغبة والمبدأ. الكوكب القمة يصبح موضع الاختبار الذي تتركز فيه قضايا الإنسان الكبرى، وتُعاد إليه السيرة مراراً حتى يُحَلّ. التحول لا يأتي تدريجياً بل بانكسار جذري ثم إعادة بناء على أسس مغايرة.,النفس التي تحمل هذا التكوين اختارت سيرة من العمق على حساب السطح. هي لا تتعلم بالحركة الكثيرة بل بالحفر في تجربة واحدة حتى قاعها. القمة في برج ثابت تشير إلى موضوع جوهري، قيمة أو ولاء أو رغبة أو مبدأ، يصبح محور الحياة كلها. الكرما المحمولة هي كرما الإصرار، إصرار خدم في حيوات سابقة وتحوّل إلى عناد، فعادت النفس لتميّز بين الإرادة الواعية والتمسك الأعمى. السيرة التي يُنتجها هذا التكوين تشتمل على تجارب مفصلية تستغرق سنوات، علاقة تشكّل العمر كله، أو مشروع لا يفلت حتى يكتمل، أو جرح يُعاد فتحه حتى يفهم. الموهبة التي تنضج هي القدرة على الالتزام الكامل، على البقاء في النار حتى يتم التحويل.,المهمة الأخلاقية هي تمييز الإرادة الحرة عن الجمود. الخطر المتصلب هو الأخطر هنا، إذ يتحول التمسك إلى تحجّر، فلا يستطيع الإنسان تحرير قبضته حتى عن أمر فقد معناه، ويبني هويته على عناد لا يخدم شيئاً سوى الاستمرار بذاته. الخطر الوهمي يظهر حين يقنع الإنسان نفسه بأن إصراره مقدّس وأنه وحده يحمل الحقيقة في معركة هي محض ذاتية، فيصير المبدأ ستاراً للأنا المتضخمة. التوازن الحي هو الاحتفاظ بالعمق والالتزام مع القدرة على التحرير حين تطلب اللحظة ذلك، على فتح القبضة في موضع وإحكامها في موضع، بحيث تخدم القوة الثابتة قراراً واعياً لا مجرد تكرار الذات.,"Tierney, Dynamics of Aspect Analysis; Greene, The Astrology of Fate; Tompkins, Aspects in Astrology",filled,
14,T-Square,Aspect Templates,,,,T14_TSquare_Mutable,Mutable T-Square — adaptive tension,المربع التائي في الأبراج المتحولة، الجوزاء والعذراء والقوس والحوت، يصف توتراً متعدد الواجهات لا يستقر على صورة واحدة. الكواكب الثلاثة تتبادل الأدوار وتنقل الضغط بينها كأنها في حوار لا ينتهي. القراءة التقليدية تربط هذا التكوين بمسائل الذكاء والتمييز والإيمان والمعنى. الكوكب القمة يصبح موضع التشتت، يستقبل ضغطاً من جهتين متقابلتين ويُطلب منه أن يفهم، أن يحلل، أن يدمج. هذا الشكل ينتج عقولاً واسعة قادرة على رؤية الأمر من زوايا متعددة، لكنه ينتج كذلك حياة كثيرة التقلب، يصعب على صاحبها أن يستقر في وضع واحد أو رأي واحد أو علاقة واحدة لوقت طويل. التحدي هنا ليس في الإرادة بل في الفهم.,النفس التي تختار هذا التكوين تأتي لتتعلم التمييز. هي تعرف من حيوات سابقة كيف تتحرك في الأفكار وكيف تقول في كل سياق ما يناسبه، لكنها لم تتعلم بعد أن تختار. القمة في برج متحول تشير إلى مهمة فكرية أو روحية أو خدمية تستدعي تكاملاً للأطراف المتقابلة، لا انحيازاً لأحدها. الكرما المحمولة هي كرما المعلم الذي توزّع بين دروب كثيرة دون أن يُتقن واحداً، فعاد ليتعلم العمق بعد الاتساع. السيرة التي يُنتجها هذا التكوين تشتمل على تحولات مهنية متعددة، تنقلات جغرافية، أزمات إيمانية، ودراسات متعاقبة لا تُختم بسهولة. الموهبة التي تنضج هي القدرة على فهم الإطار الأكبر ورؤية كيف تتداخل المجالات.,المهمة الأخلاقية هي تمييز التكيّف الذكي عن الانجراف. الخطر المتصلب يظهر حين يتحول العقل إلى آلة تحليل بلا توقف، ينقد ويفكك ويحلل دون أن يلتزم بشيء، فتصير الذكاء قناعاً للجبن عن الاختيار. الخطر الوهمي يظهر حين يقنع الإنسان نفسه بأنه يحيط بكل شيء فيتشتت بين المعارف والآراء والمشاريع، ويوهم نفسه بأن هذا الاتساع هو حكمة، بينما هو هروب من العمق. التوازن الحي هو الاحتفاظ بمرونة الفهم مع القدرة على الالتزام، على قول لا حين يلزم ونعم حين يلزم، على البقاء في حقل واحد وقتاً كافياً ليُثمر، ثم الانتقال حين يكون ذلك خياراً واعياً.,"Tierney, Dynamics of Aspect Analysis; Tompkins, Aspects in Astrology; Arroyo, Chart Interpretation Handbook",filled,
15,Grand Cross,Aspect Templates,,,,T15_GrandCross_Cardinal,Cardinal Grand Cross,الصليب الأكبر في الأبراج الأساسية تكوين نادر وثقيل، أربعة كواكب أو أكثر تنتشر في الحمل والسرطان والميزان والجدي بزوايا قائمة متعاقبة. ليس هناك قمة واحدة، بل أربع جبهات مفتوحة في الآن نفسه، كل كوكب يقابل آخر ويربّع اثنين. القراءة التقليدية ترى في هذا الشكل مهمة حياة لا تُحَل بالاختيار بين الأطراف بل باحتمالها جميعاً. الإنسان الحامل لهذا التكوين يجد نفسه في كل مرحلة عمرية أمام أربعة استحقاقات متزامنة، الذات والعائلة والعلاقات والمكانة، ولا يستطيع تأجيل أحدها لحساب آخر. السيرة التي يُنتجها هذا الشكل تشتمل على فترات شدة استثنائية، يُختبر فيها الإنسان من كل الاتجاهات في الوقت ذاته.,النفس التي تختار هذا التكوين تأتي لتنجز مهمة بيوغرافية كاملة، لا تطوير جانب واحد بل تكامل أربعة محاور أساسية في حياة واحدة. الكرما المحمولة هائلة، عادةً نتيجة حيوات سابقة جرى فيها تأجيل التكامل، أو تطوير قطب على حساب القطب المقابل، فعادت النفس لتُنجز كل شيء دفعة واحدة. هذا الشكل لا يُمنح إلا لنفوس قطعت شوطاً تطورياً معتبراً، إذ يتطلب من حاملها قدرة على الاحتمال لا تتوفر إلا بعد تدريب طويل عبر الحيوات. السيرة التي يُنتجها هي سيرة بيوغرافية ثقيلة الوزن، تُقرأ كأحد النصوص الكبرى، فيها مفاصل واضحة وأزمات معروفة وإنجازات تُحفظ. الموهبة التي تنضج هي قدرة استثنائية على القيادة في الفوضى.,المهمة الأخلاقية لا تحتمل الاختزال. الخطر المتصلب يظهر حين يقرر الإنسان أن العبء أكبر من طاقته فيغلق على نفسه، يبني جداراً ويحصر حياته في زاوية واحدة، فينطفئ المشروع الأكبر الذي حملته نفسه لهذه الحياة. الخطر الوهمي يظهر حين يقنع نفسه بأنه بطل ملحمي يحتمل ما لا يحتمله أحد، فيستهلك جسده وعلاقاته في خدمة صورة عن الذات أكبر من الواقع، ويسقط حين يكتشف أنه إنسان لا أكثر. التوازن الحي هو قبول الثقل دون تضخيمه، توزيع الانتباه على المحاور الأربعة مع الاعتراف بأن كل مرحلة عمرية ستُبرز محوراً، والاتكال على قوة لا تنبع من الأنا وحدها بل من معنى أكبر يخدمه الإنسان.,"Tierney, Dynamics of Aspect Analysis; Tierney, All Around the Zodiac; Greene, Saturn",filled,
15,Grand Cross,Aspect Templates,,,,T15_GrandCross_Fixed,Fixed Grand Cross,الصليب الأكبر في الأبراج الثابتة تكوين نادر يحمل وزناً بيوغرافياً هائلاً. أربعة كواكب تنتشر في الثور والأسد والعقرب والدلو، أبراج الإرادة والقيمة والرغبة والمبدأ، تتشابك في صليب لا ينحلّ بسهولة. القراءة التقليدية ربطت هذا التكوين بصور الاختبار الكبرى، إذ تُختبر إرادة الإنسان من أربع جهات في الآن نفسه، وتُطلب منه ولاءات متعارضة لا يمكن إرضاؤها كلها. هذا الشكل ينتج شخصيات تحفر اسمها في التاريخ، إما بإنجاز استثنائي أو بانكسار استثنائي، وقلّما تمر بمنطقة وسطى. السيرة التي يُنتجها مليئة بالعقد المصيرية، اللحظات التي يقف فيها الإنسان على عتبة قرار يُغيّر مسار العمر كله.,النفس الحاملة لهذا التكوين تأتي بمهمة مركّزة على التحويل، تحويل كثافة الرغبة إلى كثافة الروح، تحويل الإرادة الذاتية إلى إرادة تخدم الكل. الكرما المحمولة عميقة، نفس تراكمت لديها قوة إرادة هائلة عبر الحيوات لكنها لم تتعلم بعد أن تضعها في خدمة شيء أكبر من الذات. الصليب الثابت هو الموضع الذي تُعاد فيه النفس إلى نقطة الالتزام مرة بعد مرة، حتى تختار من عمقها لا من اضطرارها. السيرة المنتجة تشتمل على تجارب موت ورمزي مفصلي، انكسارات في الصحة أو السلطة أو العلاقة تُجبر الإنسان على إعادة بناء جذري. الموهبة التي تنضج هي قدرة على البقاء في النار التحويلية، قدرة قلّ من يحتملها.,المهمة الأخلاقية هنا قاسية وصريحة. الخطر المتصلب هو الأشد حضوراً في هذا التكوين، إذ تتحجر الإرادة وتنغلق على ذاتها، فيصير الإنسان قلعة محصنة لا يدخلها أحد ولا تتغير، ويُهدر عمر بأكمله في الدفاع عن مواقف فقدت معناها. الخطر الوهمي يظهر حين يتضخم الإحساس بالمصير فيقنع الإنسان نفسه بأنه مكلف بمهمة كونية، فيُسقط على من حوله أعباءً ليست لهم، ويرى في كل خلاف معركة وجودية. التوازن الحي هو الاحتفاظ بكثافة الإرادة مع القدرة على التحرير، على القبول بأن النار التحويلية تأتي من خارج الأنا، وعلى السماح للإنسان القديم بالموت ليولد إنسان جديد في كل دورة.,"Tierney, Dynamics of Aspect Analysis; Greene, Saturn; Forrest, The Inner Sky",filled,
15,Grand Cross,Aspect Templates,,,,T15_GrandCross_Mutable,Mutable Grand Cross,الصليب الأكبر في الأبراج المتحولة، الجوزاء والعذراء والقوس والحوت، يصف مهمة فهم وخدمة متعددة الجبهات. أربعة كواكب تتوزع على أبراج الذكاء والتحليل والإيمان والاتساع، تتشابك في زوايا قائمة متعاقبة. القراءة التقليدية ربطت هذا الشكل بحياة المعلم أو الطبيب أو الكاهن أو الفنان، أي شخصية تحمل عبء الفهم من أجل الجماعة. هذا الشكل لا يهدأ ولا يستقر، إذ يجد صاحبه نفسه دوماً مدعواً لاستيعاب موقفين متناقضين والتوفيق بينهما، ثم لا يكاد ينتهي حتى يستدعى لتوفيق آخر. السيرة المنتجة سيرة كثيرة التحولات في المهنة والجغرافيا والإيمان، يتنقل فيها الإنسان بين عوالم متباعدة حتى يبني فهماً يجمعها.,النفس الحاملة لهذا التكوين تأتي بمهمة الوسيط التطوري، ذاك الذي يحمل بين يديه أكثر من إطار للعالم ويُترجم بينها. الكرما المحمولة كرما العقل الذي علّم في حيوات سابقة لكن تشتت في النهاية، فعادت النفس لتجمع ما تفرّق وتتقن فن التركيب. الصليب المتحول يضع صاحبه في موضع الجسر بين عوالم، بين الشرق والغرب، بين القديم والحديث، بين العلم والروح، وكل مرحلة من العمر تطرح عليه نسخة جديدة من هذا الجسر. السيرة المنتجة مليئة بالأسفار الذهنية والجغرافية، بالدراسات المتعاقبة، بالعلاقات التي تربط بين الإنسان وعوالم لم يكن يعرفها. الموهبة التي تنضج هي قدرة استثنائية على الفهم المتعدد الطبقات.,المهمة الأخلاقية هي التمييز بين الاتساع الخادم والاتساع الهارب. الخطر المتصلب يظهر حين يتحول العقل إلى آلة تصنيف بلا روح، يحلل كل شيء ولا يلتزم بشيء، فتصير المعرفة درعاً يفصل الإنسان عن الحياة. الخطر الوهمي يظهر حين يقنع الإنسان نفسه بأنه يحيط بكل الأطر فيتشتت بين أكثر مما يحتمل، يبدأ مشاريع كثيرة لا ينهي منها شيئاً، ويُسقط على حياته صورة الحكيم الذي يفهم كل شيء بينما هو لا يلتزم بأي شيء. التوازن الحي هو وضع الفهم في خدمة عمل ملموس، الاحتفاظ بقدرة الترجمة بين العوالم مع الالتزام بمسار واحد لوقت كافٍ لإثماره.,"Tierney, Dynamics of Aspect Analysis; Tompkins, Aspects in Astrology; Arroyo, Astrology Karma and Transformation",filled,
16,Grand Trine,Aspect Templates,,,,T16_GrandTrine_Fire,Fire Grand Trine,المثلث الكبير في عنصر النار، الحمل والأسد والقوس، يصف دائرة مغلقة من الانسياب بين ثلاثة كواكب تتبادل التغذية في عنصر الحماس والإرادة والرؤيا. القراءة التقليدية ربطت هذا الشكل بالموهبة الفطرية في القيادة والإلهام والثقة بالنفس. الإنسان الحامل لهذا التكوين يبدو وكأنه ولد حاملاً جذوة لا تنطفئ، يندفع إلى الحياة بلا حاجة إلى محرك خارجي، ويُلهم من حوله دون أن يُجهد. هذا الشكل ينتج شخصيات كاريزمية تجد طريقها بسهولة في مجالات الفن والتعليم والريادة. لكنه شكل يحمل في طياته خطر الانغلاق على ذاته، إذ تشتغل الدائرة بكفاءة لدرجة أنها قد لا تشعر بالحاجة إلى أي تحدٍ من الخارج، فيتحول الانسياب إلى ركود ذهبي.,النفس الحاملة لمثلث ناري كبير تأتي مع رصيد كرمي مكتسب من حيوات سابقة، نفس عملت على نار الإرادة وتعلمت الاندفاع بشجاعة، فولدت هذه المرة وهبة الحضور جاهزة. لكن هذا الرصيد لا يُمنح بلا ثمن، إذ تحمل النفس مهمة التحقق من أنها لن تنام على ميراثها. السيرة التي يُنتجها هذا التكوين تشتمل على إنجازات مبكرة، نجاحات لا تكلف جهداً يذكر، وثقة بالنفس تتجاوز السن العملي. لكن في عمق هذه السيرة سؤال مستمر، هل ما أفعله يستحق الموهبة الممنوحة؟ المهمة التطورية هي تحويل الموهبة إلى خدمة، خروج النار من دائرتها المغلقة لتُضيء الآخرين. حين تُفعَّل بكوكب يكسر الانغلاق، يتحول المثلث إلى نبع يفيض.,المهمة الأخلاقية هي خرق الكفاية الذاتية. الخطر المتصلب يظهر هنا في صورة هادئة وخادعة، إذ لا يبدو هناك ضغط يستدعي التحرك، فيركن الإنسان إلى مواهبه ويُهدر سنوات في تمارين متكررة لا تطوّره. الخطر الوهمي هو الأشد حضوراً في هذا التكوين، إذ يقنع الإنسان نفسه بأن سهولة الإنجاز دليل تفوق، فيرفض النقد ويهرب من المواجهة ويعيش في وهم البطل الذي لا يحتاج تطويراً. التوازن الحي هو طلب التحدي بوعي، الدخول طوعاً في ميادين تُكلّف جهداً، وضع المواهب في مواقف لا تُضمن نتائجها، حتى تتحول النار من حرارة داخلية إلى ضوء يخدم العالم.,"Tierney, Dynamics of Aspect Analysis; Hand, Horoscope Symbols; Tompkins, Aspects in Astrology",filled,
