template_num,template_name,category,body_a,body_b_or_sign,house_or_aspect,placement_id,focus_theme,traditional_meaning_ar,evolutionary_meaning_ar,developmental_task_ar,key_references,status,content_file
16,Grand Trine,Aspect Templates,,,,T16_GrandTrine_Earth,Earth Grand Trine,المثلث الكبير في عنصر التراب، الثور والعذراء والجدي، يصف دائرة مغلقة من الانسياب في عنصر الجسد والعمل والمادة. القراءة التقليدية ربطت هذا التكوين بالموهبة الفطرية في إدارة الموارد والمهارة العملية والصبر على البناء طويل الأمد. الإنسان الحامل لهذا الشكل يجد العالم المادي طيّعاً تحت يده، يفهم بسهولة كيف تشتغل الأنظمة وكيف تُبنى الهياكل وكيف تُدار الأموال. هذا الشكل ينتج حرفيين متقنين، مزارعين موهوبين، مهندسين بفطرة، ورجال أعمال يبنون مؤسسات تدوم. لكن خطره أن تشتغل الدائرة بكفاءة لدرجة لا تترك مساحة للروح، فتتحول الحياة إلى إنتاج متواصل لا غاية له سوى استمرار الإنتاج، ويصير الإنسان عبداً لجهازه التنفيذي الخاص.,النفس الحاملة لمثلث ترابي كبير تأتي برصيد من حيوات سابقة عملت فيها على إتقان المادة، تعلّمت العمل اليدوي والبناء والصبر. هذا الرصيد يُمنح هذه المرة هبةً، لكنه يحمل مهمة تطورية محددة، ألا يبقى الإنسان أسير الكفاءة المادية. السيرة التي يُنتجها هذا التكوين تشتمل على استقرار مبكر، قدرة على بناء حياة عملية متينة، وعلاقة سليمة مع المال والأشياء. لكن في عمق هذه السيرة سؤال متكرر، ما الذي يحرك كل هذا البناء؟ المهمة التطورية هي تحويل المادة إلى أداة، إدخال البعد الروحي أو الخدمي على الإنجاز المادي حتى لا يصير الإنجاز هدفاً بحد ذاته. حين يُفعَّل المثلث بكوكب يربطه بالعالم الأوسع، يتحول البناء المادي إلى وعاء لمعنى.,المهمة الأخلاقية هي تحرير الحياة من سيطرة الكفاءة المادية. الخطر المتصلب هو الأخطر هنا، إذ يتحول الإنسان إلى آلة منتجة، يبني ويراكم ويُحسّن دون أن يسأل لماذا، فيمر العمر في عمل متقن وفارغ في الآن نفسه. الخطر الوهمي يظهر حين يقنع الإنسان نفسه بأن متانة بنائه دليل صحة حياته، فيقيس قيمته بما يملك أو ينتج، ويرفض كل سؤال يهدد اطمئنانه المادي. التوازن الحي هو وضع الكفاءة في خدمة معنى أوسع، الإبقاء على الموهبة المادية مع الاستعداد للتخلي عن جزء من الراحة في سبيل عمل لا يُقاس بمعايير الإنتاج، حتى تصبح المادة وعاء للروح لا بديلاً عنها.,"Tierney, Dynamics of Aspect Analysis; Arroyo, Chart Interpretation Handbook; Hand, Horoscope Symbols",filled,
16,Grand Trine,Aspect Templates,,,,T16_GrandTrine_Air,Air Grand Trine,المثلث الكبير في عنصر الهواء، الجوزاء والميزان والدلو، يصف دائرة مغلقة من الانسياب في عنصر الفكر والعلاقة والفكرة. القراءة التقليدية ربطت هذا التكوين بالموهبة الفطرية في التواصل والربط والتفكير التجريدي. الإنسان الحامل لهذا الشكل يفهم الناس بسهولة، يجد الكلمة المناسبة في كل سياق، ويلتقط الأفكار والروابط بسرعة. هذا الشكل ينتج كتّاباً ومعلمين ودبلوماسيين وأصحاب شبكات اجتماعية واسعة. لكن خطره أن يشتغل العقل في فراغ، فلا تتحول الأفكار إلى التزام ولا تصبح العلاقات عميقة. الدائرة الهوائية تتغذى على ذاتها بكفاءة، فيبدو الإنسان ذكياً ومحبوباً ومنفتحاً، لكنه يفتقد العمق الذي يصنع الحياة الجادة.,النفس الحاملة لمثلث هوائي كبير تأتي برصيد من حيوات سابقة عملت على العقل والكلمة والعلاقة. هذا الرصيد يُمنح هذه المرة هبةً، فيولد الإنسان وهو يعرف كيف يتعامل مع الناس وكيف يصوغ فكرته. لكن المهمة التطورية تقول إن الموهبة الفكرية وحدها لا تُنجي، وإن الحياة تطلب جذراً لا تستطيع الكلمة وحدها أن تُغرسه. السيرة التي يُنتجها هذا التكوين تشتمل على شبكات علاقات واسعة، نجاحات في مجالات الإعلام والتعليم والوساطة، لكنها قد تشتمل أيضاً على إحساس عميق بالعزلة وسط الجمع. المهمة هي إنزال الفكرة إلى الأرض، تحويل القدرة على الحديث إلى التزام عملي، وربط شبكة العلاقات بنواة صلبة من علاقات قليلة عميقة.,المهمة الأخلاقية هي خرق الدائرة الذهنية. الخطر المتصلب يظهر حين يتحول العقل إلى آلة تحليل بلا روح، يستوعب كل شيء ولا يلتزم بشيء، فيمر العمر في حوارات لامعة ومشاريع فكرية لا تنجز. الخطر الوهمي هو الأشد حضوراً، إذ يُسقط الإنسان على نفسه صورة المثقف الذي يفهم كل شيء، فيُهدر سنوات في الاستعراض الفكري والاجتماعي، يقنع نفسه بأن وفرة الأفكار تساوي عمقاً، بينما هو يتحرك على السطح. التوازن الحي هو وضع العقل في خدمة فعل ملموس، الاحتفاظ بسعة الذهن مع الالتزام بعلاقة قليلة عميقة وبفكرة واحدة تتطلب البناء الطويل، حتى يصبح الهواء حاملاً للجسد لا بديلاً عنه.,"Tierney, Dynamics of Aspect Analysis; Tompkins, Aspects in Astrology; Hand, Horoscope Symbols",filled,
16,Grand Trine,Aspect Templates,,,,T16_GrandTrine_Water,Water Grand Trine,المثلث الكبير في عنصر الماء، السرطان والعقرب والحوت، يصف دائرة مغلقة من الانسياب في عنصر الشعور والذاكرة والحدس. القراءة التقليدية ربطت هذا التكوين بالموهبة الفطرية في التعاطف وقراءة ما تحت السطح والاستقبال غير اللفظي. الإنسان الحامل لهذا الشكل يحمل عوالم نفسية ثرية، يلتقط ما يشعر به الآخرون قبل أن ينطقوا، ويعيش في تواصل دائم مع طبقات لا واعية. هذا الشكل ينتج فنانين وشعراء ومعالجين وروحانيين وصور أم استثنائية. لكن خطره أن تشتغل الدائرة العاطفية بكفاءة لدرجة تغرق صاحبها، فيصير الشعور كل شيء وتغيب القدرة على التمييز بين مشاعره الخاصة ومشاعر من حوله، ويُهدر العمر في حركة عاطفية لا تتبلور.,النفس الحاملة لمثلث مائي كبير تأتي برصيد من حيوات سابقة عملت على العاطفة والتعاطف والذاكرة الجمعية. هذا الرصيد يُمنح هذه المرة هبةً، فتولد النفس وهي تعرف لغة الشعور قبل أي تعليم. لكن المهمة التطورية تقول إن العمق العاطفي وحده لا يكفي، وإن الحياة تطلب شكلاً يحتوي الماء وإلا تبدد. السيرة التي يُنتجها هذا التكوين تشتمل على علاقات كثيرة الكثافة، استدعاءات من العالم غير المرئي، تجارب نفسية عميقة تصل أحياناً إلى التماهي مع ألم الآخرين. المهمة هي إيجاد وعاء صلب للماء، شكل من الانضباط أو الإيمان أو العمل يمنع الفيض من أن يصير غرقاً، ويسمح للحدس بأن يخدم الحياة لا أن يستهلكها.,المهمة الأخلاقية هي تمييز الذات في بحر التعاطف. الخطر المتصلب يظهر حين يُغلق الإنسان على عاطفته خوفاً من الفيض، فيبني جداراً بين نفسه وما يشعر به، ويبدو هادئاً بينما هو منفصل عن نواته الحيوية. الخطر الوهمي هو الأشد حضوراً، إذ يذوب الإنسان في عواطف الآخرين أو في خيالاته الخاصة، فيقنع نفسه بأن الكثافة العاطفية معنى، بينما هو يهرب من المسؤولية في موجات من الحساسية. التوازن الحي هو الاحتفاظ بحدة الحدس والقدرة على الاستقبال مع بناء حدود واعية، تمييز ما هو لي مما هو لغيري، وضع الماء في وعاء يخدم العمل بدل أن يُغرقه.,"Tierney, Dynamics of Aspect Analysis; Reinhart, Chiron and the Healing Journey; Greene, Relating",filled,
17,Yod / Finger of God,Aspect Templates,,,,T17_Yod,Two quincunxes converging on one apex,اليود، أو إصبع القدر، تكوين دقيق ومحدد، كوكبان بينهما زاوية ستين درجة يلتقيان عند كوكب ثالث بزاويتي مائة وخمسين درجة. القمة في هذا الشكل تقف وحيدة، تستقبل توتراً غير مألوف من قطبين لا يجمعهما تشابه مع ما تحمله. القراءة التقليدية وصفت هذا التكوين بأنه موعد كرمي، نقطة في الخريطة تشير إلى مهمة بعينها، مهمة لا تشبه أي شيء آخر في حياة صاحبها ويصعب توقعها من قراءة بقية العناصر. الإنسان الحامل ليود يشعر منذ سن مبكرة بأن ثمة شيئاً غير عادي ينتظره، شيء يأتي بالعرض لا بالطلب، ولا يتم تفعيله إلا بمرور كوكب سيار أو حدث خارجي يضغط على القمة.,النفس الحاملة ليود اختارت أن تأتي بمهمة بعينها، وقّعت قبل الميلاد على عقد محدد المعالم. هذه المهمة لا تنبع من المزاج العام للخريطة، بل تأتي مثل جسم غريب يطلب أن يُدمج. القمة تشير إلى الفعل المطلوب، والكوكبان المغذيان يحملان الموارد التي يجب توظيفها فيه، وإن كانا لا يعرفان أحدهما الآخر إلا عبر القمة. السيرة التي يُنتجها هذا التكوين مليئة بمنعطفات تبدو غير مفهومة من الخارج، لقاءات صدفة تغير مسار العمر، مرض أو حادث يفتح باباً لم يكن مقصوداً، أو نداء داخلي يقود الإنسان إلى مهنة بعيدة عن خلفيته. الموهبة التي تنضج هي قدرة على القراءة الرمزية للحياة، تمييز نقاط التحويل، والثقة بالحركة حين تأتي حتى لو لم يفهمها العقل.,المهمة الأخلاقية هي الاستجابة للنداء دون استعجاله ودون إنكاره. الخطر المتصلب يظهر حين يرفض الإنسان أن المهمة مختلفة عن باقي حياته، فيحاول إقحامها في مسار مألوف أو يتجاهل الإشارات لأنها لا تنسجم مع خططه، فيقضي العمر في عمل صحيح ظاهراً لكنه يعلم في عمقه أنه ليس ما جاء لأجله. الخطر الوهمي يظهر حين يتضخم الإحساس بالمصير فيقنع الإنسان نفسه بأن كل تفصيل في حياته جزء من خطة كونية، فيتوقف عن العيش العادي بحثاً عن لحظة الاستدعاء، ويُهدر سنوات في انتظار إشارة. التوازن الحي هو الإقامة في الحاضر مع البقاء منصتاً، أداء العمل اليومي مع الاستعداد للانعطاف حين يأتي، والثقة بأن المهمة ستجد طريقها.,"Tierney, Dynamics of Aspect Analysis; Tompkins, Aspects in Astrology; Forrest, The Inner Sky",filled,
18,Kite,Aspect Templates,,,,T18_Kite,Grand Trine with directed opposition,الطائرة الورقية تكوين يجمع المثلث الكبير مع تقابل موجّه، إذ يقع كوكب رابع في مقابلة أحد رؤوس المثلث، فيكسر انغلاق الدائرة الانسيابية ويعطيها وجهة. القراءة التقليدية ترى في هذا الشكل صورة المثلث الذي وجد رسالته، الموهبة التي وجدت من تخدمه. الكوكبان المتقابلان يصنعان محوراً يحمل الطاقة المنسابة في المثلث ويوجهها إلى هدف خارجي. هذا الشكل ينتج شخصيات استثنائية في قدرتها على ترجمة موهبتها إلى أثر في العالم، فنانون يجدون جمهورهم، معلمون يجدون تلاميذهم، قادة يجدون قضيتهم. وعلى عكس المثلث الكبير المنفرد، لا يقع صاحب الطائرة الورقية في فخ الكفاية الذاتية، إذ يدفعه التقابل دوماً إلى الخارج.,النفس الحاملة لطائرة ورقية تأتي برصيد كرمي مهيأ للظهور. المثلث الكبير يحمل المواهب المكتسبة من حيوات سابقة، والتقابل الموجّه يحمل مهمة هذه الحياة، اللقاء أو الجمهور أو الميدان الذي ينتظر الموهبة. هذا التكوين يصف نفساً قطعت شوطاً تطورياً، وُهبت كل ما تحتاج، وتُرسل هذه المرة لتفعيل الهبة في خدمة العالم. السيرة التي يُنتجها مليئة بلحظات اكتشاف مبكر، لقاء معلم أو شريك يفتح الباب، استدعاء من ميدان كان يبدو بعيداً ثم تبيّن أنه الموطن الحقيقي. القطب المقابل يحمل أيضاً درس الحياة، الجانب الذي يجب أن تتعلمه النفس من الآخر، والذي بدونه يبقى المثلث ميراثاً معطلاً. الموهبة التي تنضج هي قدرة على الظهور بلا تكلف، حضور يجذب دون أن يطلب.,المهمة الأخلاقية هي حماية المنحة من التشوه. الخطر المتصلب يظهر حين يستقر الإنسان في النجاح المبكر فيتوقف عن التطوير، يكرر ما أجاد حتى يفقد حرارته، ويتحول الموهوب إلى محترف بارد يستثمر ميراثه دون أن يضيف إليه. الخطر الوهمي يظهر حين يُسقط الإنسان على نفسه صورة المختار، فيقنع نفسه بأن النجاح دليل تفوق على غيره، وينقطع عن أرض الحياة العادية حيث يعيش الناس الذين يفترض أنه يخدمهم. التوازن الحي هو الاحتفاظ بالموهبة في وضع الخدمة، الإقامة عند القطب المقابل بقدر الإقامة عند رؤوس المثلث، والاستمرار في التعلم من الميدان نفسه حتى لا تصير المنحة قيداً بدل أن تكون جناحاً.,"Tierney, Dynamics of Aspect Analysis; Tierney, All Around the Zodiac; Hand, Horoscope Symbols",filled,
