template_num,template_name,category,body_a,body_b_or_sign,house_or_aspect,placement_id,focus_theme,traditional_meaning_ar,evolutionary_meaning_ar,developmental_task_ar,key_references,status,content_file
36,Synastry Planet x Planet,Relational,الشمس,القمر,,T36_general,How charts aspect each other — see general framework,السيناستري في تقليده الفلكي الراسخ هو فن مقارنة خريطتين ميلاديتين كوكباً بكوكب، لاستخلاص شبكة الاتصالات الزاوية بين أجرام كل شريك وأجرام الآخر. تنشأ القراءة من ملاحظة كيف يلامس كوكب من خريطة الأول جرماً في خريطة الثاني عبر الاقتران أو التثليث أو التسديس أو التربيع أو المقابلة، ومن قياس قوة كل اتصال بمدى الاتساق وأهمية الجرمين المعنيين. تقرأ المدرسة الكلاسيكية الشمس والقمر والزهرة والمريخ كركائز لطبيعة الصلة، بينما يكشف زحل وأورانوس وبلوتو الالتزام والشد والتحول العميق. يلخص هذا التقليد أن كل اتصال بين كوكبين من خريطتين يفعّل في كل شريك ما يحمله الآخر، ويُترجم إلى مشاهد متكررة في الحياة اليومية للعلاقة. هذا الإطار لا يحكم على نجاح الصلة، بل يصف تضاريسها.,على المستوى الأعمق، تكشف الاتصالات بين الكوكبين أن كل علاقة عميقة هي ميدان تنشيط متبادل لما لم يكتمل في كل نفس. حين يلمس مريخ شريك زحل الشريك الآخر، لا يقع لقاء سطحي بل يجري عقد كرمي قديم بين قوتين كان لا بد لهما أن تتعارفا في هذه الحياة. تكشف الكواكب الداخلية ما تتبادله النفسان من غذاء انفعالي ومعرفي، بينما تكشف الكواكب الخارجية المهمة التطورية المشتركة، تلك التي اختارت النفسان حملها معاً. كل اتصال صعب ليس عقوبة بل دعوة لتعلم درس لم يمكن تعلمه في عزلة، وكل اتصال متناغم ميراث من حيوات سابقة تعرفت فيها النفسان على بعضهما. تتحول العلاقة في هذا الضوء إلى مدرسة لا إلى مكافأة، وتصبح أزماتها فرص استيقاظ للأنا الواعية الحرة في كل شريك.,المهمة أن يقرأ كل شريك شبكة الاتصالات بوصفها مرآة لما يطلبه نموه هو، لا سجلاً لعيوب الآخر. الخطر المتصلب أن تختزل العلاقة إلى قائمة توافقات وعدم توافقات، فتُحكم عليها بالنجاح أو الفشل قبل أن تُعاش، أو تُستخدم الخريطة سلاحاً لتبرير المسافة. الخطر الوهمي أن يتحول كل اتصال متناغم إلى وعد قدري بالسعادة، فيُعفى الشريكان من العمل اليومي على الإصغاء والتسوية، أو يُرى كل اتصال صعب علامة على لقاء أرواح توأم تبرر التضحية المرضية. التوازن الحي أن تُقرأ الشبكة كمشهد طبوغرافي للعلاقة، فيعرف كل شريك أين يحتاج إلى يقظة إضافية وأين يستطيع أن يتكئ، ثم يدخل الحياة المشتركة بوعي بأن الكواكب تصف لا تأمر.,Sue Tompkins — The Contemporary Astrologer's Handbook; Reinhold Ebertin — Combination of Stellar Influences; Stephen Arroyo — Relationships and Life Cycles,filled,
36,Synastry Planet x Planet,Relational,,,,T36_Synastry,Framework: planet-to-planet inter-aspects between two charts,إطار السيناستري بين كوكب وكوكب يقوم على تركيب خريطتين فوق بعضهما، خريطة كل شريك في حلقتها الخاصة، ثم رسم خطوط الاتصال الزاوية بين كل جرم في الخريطة الأولى وكل جرم في الثانية. يضع التقليد الفلكي قواعد لقياس مدى الاتساق، فيعطي وزناً أكبر للاتصالات الضيقة دون درجتين، ويميز بين الاتصالات اللينة كالتثليث والتسديس والاتصالات المتطلبة كالتربيع والمقابلة، ويراعي إن كان الاتصال بين جرمين من الطبيعة ذاتها أم من طبائع متنافرة. الأطر الكلاسيكية تركز على محاور خمسة هي الشمس والقمر والزهرة والمريخ وزحل، باعتبارها العمود الفقري لكل توافق طويل الأمد. هذا الإطار يصف العلاقة من زاوية اللقاء بين هويتي الشريكين، لا من زاوية العلاقة بوصفها كياناً قائماً بذاته.,الإطار في عمقه يقول إن لقاء كل شخصين عميق هو لقاء بين نسيجين كرميين، وأن الاتصالات بين الكوكبين ليست مصادفة هندسية بل تذكير بأن النفسين اختارتا أن تتلامسا في هذه الحياة. كل خط بين جرمين يحمل ذاكرة، إما من حيوات سابقة عُملت فيها مسائل مشتركة، وإما من اتفاق ما قبل الولادة على إثارة فصل جديد من النضج. النظر إلى الإطار بهذا الضوء يحرر القراءة من منطق التوافق السطحي ويعيدها إلى ميدانها الحقيقي، حيث كل علاقة تساهم في تربية الأنا الواعية الحرة في كل شريك. الكواكب الخارجية في الإطار تشير إلى الميراث الجمعي الذي ورثته النفسان معاً، والكواكب الداخلية تصف اللحم اليومي لهذا الميراث. بهذا يصبح الإطار أداة عمل روحاني، لا مجرد فهرس مقارنة.,المهمة استخدام الإطار للتعرف على حقل التعلم الذي اختاره الشريكان معاً، ثم الدخول إليه بنية واضحة. الخطر المتصلب أن يتحول الإطار إلى أداة اختبار قبلي، يقاس بها الشريك ثم يُقبل أو يُرفض على أساس ورقي، فتُقتل العلاقة قبل أن تُختبر، أو يُحبس الشريكان في وصف ميكانيكي لذاتيهما. الخطر الوهمي أن يُرفع الإطار إلى مرتبة العرافة، فيُنتظر من الكواكب أن تخبر الشريكين بمصير الصلة بدل أن يُبنى المصير يوماً بيوم، أو يُستخدم لتبرير علاقة مؤذية بحجة قدرها المكتوب. التوازن الحي أن يُقرأ الإطار مرة مع مستشار ذي بصيرة، ثم يُترك جانباً ليعمل الشريكان على ما كشفه من ميادين عمل دون تشبث بحرفيته.,Sue Tompkins — Aspects in Astrology; Noel Tyl — Synthesis and Counseling in Astrology; Stephen Arroyo — Relationships and Life Cycles,filled,
37,Synastry Planet x Angle,Relational,,,,T37_PlanetAngle,Planet falling on partner's ASC/MC/IC/DSC,حين يقع كوكب من خريطة شريك على إحدى زوايا خريطة الشريك الآخر، أي على الطالع أو وسط السماء أو قاع السماء أو نقطة المغيب، يعتبر التقليد الفلكي هذا الاتصال من أعلى الاتصالات وزناً في السيناستري كلها. السبب أن الزوايا الأربع ليست نقاطاً عابرة في الخريطة بل عتبات بيوغرافية، تحمل الطالع هوية الشخص الظاهرة، ووسط السماء مساره العام في الحياة، وقاع السماء جذره الأسري، ونقطة المغيب نمطه في الشراكة. وقوع كوكب الشريك على هذه العتبات يطبع علامة دائمة على المسار، فيُحس صاحب الخريطة بأن هذا الشخص قد دخل صلب حياته لا هامشها. تركز المدرسة الكلاسيكية على اقتران الزهرة أو المريخ بالطالع، واقتران زحل أو الشمس بوسط السماء، بوصفها أوضح أشكال هذا التأثير.,على المستوى التطوري، يشير اتصال كوكب بزاوية إلى أن الشريك جاء ليؤدي دوراً مفصلياً في فصل محدد من سيرة الآخر، لا مجرد دور عابر. الكوكب الذي يقع على الطالع يلمس صورة الذات الظاهرة، فيغير صاحب الخريطة كيف يرى نفسه في المرآة بعد لقاء هذا الشخص. الكوكب الواقع على وسط السماء يؤثر في المسار المهني والاتجاه العام، فيفتح أبواباً أو يغلقها بحسب طبيعته. الكوكب على قاع السماء يلمس الجذر العميق والذاكرة الأسرية، وكثيراً ما يستدعي شفاء أو إعادة تأسيس للبيت الداخلي. الكوكب على نقطة المغيب يحدد طبيعة الصلة نفسها ويكشف ما طلبته النفس من شريك. هذه الاتصالات لا تُنسى، تبقى بصمتها حتى لو انتهت الصلة الظاهرة، لأنها تركت في النسيج البيوغرافي علامة محفورة.,المهمة أن يعترف الإنسان بثقل اللقاء حين يقع كوكب شريك على إحدى زواياه، دون أن يستسلم لقدرية اللقاء أو يفر منه. الخطر المتصلب أن يُنكر صاحب الخريطة الأثر العميق لهذا الشخص في صياغة هويته، فيعامل العلاقة كأي علاقة أخرى ويفقد الدرس الذي جاء يحمله، أو ينفصل دون استيعاب ما فُتح. الخطر الوهمي أن يُرفع الشريك إلى مرتبة الروح التوأم القدرية بسبب هذا الاتصال، فيُلغى الحكم الحر ويُبرر التشبث بأي ثمن، أو تُختزل هوية الشخص نفسها فيمن لمس زاويتها. التوازن الحي أن يُتقبل الاتصال بوصفه فرصة بيوغرافية ثقيلة الوزن، يُستثمر فيها الوقت والوعي، ثم يبقى الإنسان مالكاً لإرادته وعتباته.,Noel Tyl — Synthesis and Counseling in Astrology; Robert Hand — Horoscope Symbols; Sue Tompkins — The Contemporary Astrologer's Handbook,filled,
38,Composite Chart,Relational,,,,T38_Composite,The relationship as a third entity,الخريطة المركبة تُحسب بأخذ نقطة المنتصف بين كل جرم في خريطة الشريك الأول ومثيله في خريطة الشريك الثاني، فيتولد من ذلك جرم مركب جديد يقع في الدرجة الوسطى بينهما. حين تُجمع كل هذه المنتصفات في حلقة واحدة تنشأ خريطة ثالثة، خريطة العلاقة بوصفها كياناً قائماً بذاته، له شمسه وقمره وطالعه وبيوته. أرسى رولاند إيبرتين هذه التقنية في القرن العشرين عبر مدرسة الكوزموبيولوجي، ثم طورها روبرت هاند في عمله الأشهر عن الكواكب في الخريطة المركبة، فأصبحت أداة قياسية في السيناستري الحديث. تُقرأ خريطة المركب كما تُقرأ خريطة ميلاد، فتكشف هوية الصلة ومسارها وحاجاتها الأساسية، وتُفسر اتصالاتها بكواكب العبور لتتبع فصول حياة العلاقة.,في عمقها، تعترف الخريطة المركبة بأن العلاقة العميقة كيان ثالث بين الشريكين، له نفسه وقدره ومهمته الخاصة التي تتجاوز مهمتي الفردين. حين تلتقي نفسان وتلتزمان، تولد من بينهما كينونة جديدة لها شخصيتها، وقد تكون هذه الكينونة مختلفة جداً عن طباع الشريكين منفصلين. بيوت المركب تخبر أين تعيش العلاقة، شمسها تخبر لماذا وُلدت، قمرها يخبر كيف تتغذى، وزحلها يخبر ما تطلبه من نضج. كثيراً ما يُلاحظ الشريكان أنهما يتصرفان داخل العلاقة بطريقة لا يتصرف بها أي منهما خارجها، وهذا توقيع الكيان الثالث. قراءة المركب بهذا الفهم تحرر الشريكين من تحميل كل منهما الآخر مسؤولية ما لا يخصه، فتُرى الصلة كقدر مشترك يخدمه الاثنان معاً، لا كأرض يتنازعان عليها.,المهمة أن يصغي الشريكان لصوت الكيان الثالث ويخدماه دون أن يذوبا فيه. الخطر المتصلب أن يُنكر وجود العلاقة بوصفها كياناً مستقلاً، فيتعامل كل شريك معها كملحق بحياته الخاصة، فتجوع الصلة وتذبل تدريجياً، أو يُختزل المركب إلى تقاطع مصالح يومية. الخطر الوهمي أن تتضخم العلاقة فتبتلع هويتي الشريكين، فيختفي الفردان في كيان مركب يصبح ديناً يُعبد، أو تُرفع الصلة إلى مرتبة مقدسة تُبرر التضحية المرضية بكل حدود الذات. التوازن الحي أن يُحترم المركب ككائن له حاجاته الخاصة، يُعطى وقته واهتمامه، ويبقى الشريكان فردين قادرين على الاختلاف، فتزدهر العلاقة بقدر ما يزدهر كل واحد فيها.,Robert Hand — Planets in Composite; Reinhold Ebertin — Combination of Stellar Influences; John Townley — Composite Charts,filled,
39,Draconic Synastry,Relational,,,,T39_Draconic,Soul-level / pre-natal karmic synastry,السيناستري الدراكوني تقنية تنطلق من تحويل كل خريطة ميلاد إلى نسختها الدراكونية، بأن تُعتبر العقدة القمرية الشمالية درجة الصفر من برج الحمل، فتتزحزح كل الكواكب بمقدار هذه الزاوية. ثم تُقارن خريطتا الشريكين الدراكونيتان كما تُقارن خريطتاهما الميلاديتان، فتُستخرج شبكة اتصالات موازية تكشف طبقة لا تظهر في السيناستري التقليدي. طورت هذه الطريقة في القرن العشرين على يد فلكيين بريطانيين، ثم بسطت باميلا كرين وآخرون استخدامها لدراسة العلاقات العميقة. تُقرأ الاتصالات الدراكونية بنفس قواعد الاتصالات العادية من حيث الاتساق وطبيعة الزاوية، لكنها تشير إلى مستوى مختلف من اللقاء بين الشريكين، أعمق من المستوى الشخصي اليومي. كثيراً ما تكتشف بهذه التقنية اتصالات قوية بين شريكين لا تبدو في خريطتيهما الميلاديتين أسباب واضحة لجذبهما المتبادل.,في عمقها، تكشف الخريطة الدراكونية للنفس ما كانت عليه قبل أن تتلبس هوية هذه الحياة، أي توقيعها قبل الولادة وما حملته من ميراث الحيوات السابقة. حين تُقارن دراكونيتا شريكين، تُكشف العقود الكرمية القائمة بينهما من قبل أن يلتقيا في هذه الحياة، تلك التي تفسر شعور كل منهما بأن الآخر معروف من قبل، وأن اللقاء استئناف لا ابتداء. اتصالات شخصية قوية في الدراكوني، خاصة بين الشمس والقمر وزحل وبلوتو، تشير إلى ميثاق روحي عميق بين النفسين، اختارتاه قبل النزول إلى الجسد. هذا لا يلغي عمل العلاقة في الحاضر، بل يضع تحته أرضية أوسع من الفصل الراهن. الذين يقرأون دراكونيتهما المشتركة يفهمون أن بعض اللقاءات تأتي لإكمال ما بدأ في فصول لم يعد يُتذكر، وأن العمل عليها يخدم النفسين فيما هو أبعد من هذه الحياة.,المهمة الاعتراف بالطبقة الكرمية للقاء دون تحويلها إلى عذر يلغي حرية اللحظة. الخطر المتصلب أن يرفض الشريكان أي بعد للقائهما يتجاوز التفاصيل اليومية، فيبقى الميثاق الذي جاءا لإتمامه دون التفات، وتتكرر الأنماط القديمة دون فهم لمنبعها، أو يُستهان بثقل اتصالات دراكونية واضحة. الخطر الوهمي أن يُختزل اللقاء إلى أسطورة كرمية مغلقة، فيُبرر كل ألم بحجة دين قديم، أو تُلغى المسؤولية الراهنة بدعوى أن كل شيء كُتب قبل الولادة، وتتحول قراءة الدراكوني إلى رواية تُهرب من الحاضر. التوازن الحي أن يُستخدم الدراكوني نافذة على الخلفية، ثم يُغلق الكتاب ويعود الشريكان إلى عملهما اليومي بإحساس متجدد بمعنى ما هما فيه.,"Pamela Crane — Draconic Astrology; Stephen Arroyo — Astrology, Karma and Transformation; Jeff Green — Pluto: The Evolutionary Journey of the Soul",filled,
